{
  "endpoint": "dois/10.1212/wnl.0000000000002282",
  "request_key": "4e408c79828ed8e0d28d41866d01da1e61134de27f04b5a94551ba7fcfbabb78",
  "request_params": {},
  "response_body": null,
  "response_hash": "74234e98afe7498fb5daf1f36ac2d78acc339464f950703b8c019892f982b90b",
  "retrieved_at": "2026-07-14T14:48:41Z",
  "schema_version": "1.0",
  "source": "datacite"
}
