{
  "endpoint": "works/doi:10.1016/0002-8703(62)90323-x",
  "request_key": "e5f9a8cf53017bf9757b30342ce667ad9bcb80f3eb30c1ffcfee9588a0f38b94",
  "request_params": {
    "select": "id,doi,ids,title,display_name,publication_year,publication_date,type,language,authorships,primary_location,best_oa_location,open_access,biblio,cited_by_count,cited_by_api_url,referenced_works,referenced_works_count,is_retracted,abstract_inverted_index"
  },
  "response_body": {
    "abstract_inverted_index": null,
    "authorships": [],
    "best_oa_location": null,
    "biblio": {
      "first_page": "577",
      "issue": "4",
      "last_page": "578",
      "volume": "63"
    },
    "cited_by_count": 289,
    "display_name": "Differentiation between normal and abnormal in electrocardiography",
    "doi": "https://doi.org/10.1016/0002-8703(62)90323-x",
    "id": "https://openalex.org/W644434195",
    "ids": {
      "doi": "https://doi.org/10.1016/0002-8703(62)90323-x",
      "mag": "644434195",
      "openalex": "https://openalex.org/W644434195"
    },
    "is_retracted": false,
    "language": "en",
    "open_access": {
      "any_repository_has_fulltext": false,
      "is_oa": false,
      "oa_status": "closed",
      "oa_url": null
    },
    "primary_location": {
      "id": "doi:10.1016/0002-8703(62)90323-x",
      "is_accepted": true,
      "is_oa": false,
      "is_published": true,
      "landing_page_url": "https://doi.org/10.1016/0002-8703(62)90323-x",
      "license": null,
      "license_id": null,
      "pdf_url": null,
      "raw_source_name": "American Heart Journal",
      "raw_type": "journal-article",
      "source": {
        "display_name": "American Heart Journal",
        "host_organization": "https://openalex.org/P4310320990",
        "host_organization_lineage": [
          "https://openalex.org/P4310320990"
        ],
        "host_organization_lineage_names": [
          "Elsevier BV"
        ],
        "host_organization_name": "Elsevier BV",
        "id": "https://openalex.org/S46995015",
        "is_core": true,
        "is_in_doaj": false,
        "is_oa": false,
        "issn": [
          "0002-8703",
          "1097-6744"
        ],
        "issn_l": "0002-8703",
        "type": "journal"
      },
      "version": "publishedVersion"
    },
    "publication_date": "1962-04-01",
    "publication_year": 1962,
    "referenced_works": [],
    "referenced_works_count": 0,
    "title": "Differentiation between normal and abnormal in electrocardiography",
    "type": "article"
  },
  "response_hash": "529491f03dc3e1e29ca05b708c5436a1ea91dd1c2fbd272cf342dc8dfdcb4539",
  "retrieved_at": "2026-07-14T13:49:30Z",
  "schema_version": "1.0",
  "source": "openalex"
}
