{
  "endpoint": "works/doi:10.1038/s98693-2021-38506-7",
  "request_key": "3396b50c4b5bb30329cd6c44bbbb39d31d02423623b6b3f375f4879c02c66752",
  "request_params": {
    "select": "id,doi,ids,title,display_name,publication_year,publication_date,type,language,authorships,primary_location,best_oa_location,open_access,biblio,cited_by_count,cited_by_api_url,referenced_works,referenced_works_count,is_retracted,abstract_inverted_index"
  },
  "response_body": null,
  "response_hash": "74234e98afe7498fb5daf1f36ac2d78acc339464f950703b8c019892f982b90b",
  "retrieved_at": "2026-07-14T14:36:37Z",
  "schema_version": "1.0",
  "source": "openalex"
}
