{
  "endpoint": "works/10.1371/s74916-2021-47222-5",
  "request_key": "6db071856e6255cb2f57adc0489d7a46d3f186efa719982197d9eb92684288f8",
  "request_params": {},
  "response_body": null,
  "response_hash": "74234e98afe7498fb5daf1f36ac2d78acc339464f950703b8c019892f982b90b",
  "retrieved_at": "2026-07-14T14:55:28Z",
  "schema_version": "1.0",
  "source": "crossref"
}
