{
  "endpoint": "v2/10.1109/cvpr.2019.00202",
  "request_key": "ff6fc7c362fefde90699b147cc449966c961e85a5dc8a673a6b8f41bbef1a7e8",
  "request_params": {},
  "response_body": {
    "best_oa_location": null,
    "data_standard": 2,
    "doi": "10.1109/cvpr.2019.00202",
    "doi_url": "https://doi.org/10.1109/cvpr.2019.00202",
    "first_oa_location": null,
    "genre": "proceedings-article",
    "has_repository_copy": false,
    "is_oa": false,
    "is_paratext": false,
    "journal_is_in_doaj": null,
    "journal_is_oa": false,
    "journal_issn_l": null,
    "journal_issns": null,
    "journal_name": "2019 IEEE/CVF Conference on Computer Vision and Pattern Recognition (CVPR)",
    "oa_locations": [],
    "oa_locations_embargoed": [],
    "oa_status": "closed",
    "published_date": "2019-06-01",
    "publisher": "IEEE",
    "title": "Revisiting Self-Supervised Visual Representation Learning",
    "updated": "2025-08-17T18:46:03Z",
    "year": 2019,
    "z_authors": [
      {
        "author_position": "first",
        "is_corresponding": true,
        "raw_affiliation_strings": [
          "Google Brain, Zürich, Switzerland"
        ],
        "raw_author_name": "Alexander Kolesnikov"
      },
      {
        "author_position": "additional",
        "is_corresponding": false,
        "raw_affiliation_strings": [
          "Google Brain, Zürich, Switzerland"
        ],
        "raw_author_name": "Xiaohua Zhai"
      },
      {
        "author_position": "last",
        "is_corresponding": false,
        "raw_affiliation_strings": [
          "Google Brain, Zürich, Switzerland"
        ],
        "raw_author_name": "Lucas Beyer"
      }
    ]
  },
  "response_hash": "be98aaaf4485fecf1accb871aa1eea270fd9fbda84c543b6db3337c3b53ea37f",
  "retrieved_at": "2026-07-14T14:15:55Z",
  "schema_version": "1.0",
  "source": "unpaywall"
}
