{
  "endpoint": "v2/10.1109/tcsvt.2020.3003048",
  "request_key": "7f1978d6836ab3f1e529ad43081c5516648918b106de9457ae3e869a2a7d3904",
  "request_params": {},
  "response_body": {
    "best_oa_location": null,
    "data_standard": 2,
    "doi": "10.1109/tcsvt.2020.3003048",
    "doi_url": "https://doi.org/10.1109/tcsvt.2020.3003048",
    "first_oa_location": null,
    "genre": "journal-article",
    "has_repository_copy": false,
    "is_oa": false,
    "is_paratext": false,
    "journal_is_in_doaj": false,
    "journal_is_oa": false,
    "journal_issn_l": "1051-8215",
    "journal_issns": "1051-8215,1558-2205",
    "journal_name": "IEEE Transactions on Circuits and Systems for Video Technology",
    "oa_locations": [],
    "oa_locations_embargoed": [],
    "oa_status": "closed",
    "published_date": "2020-06-17",
    "publisher": "Institute of Electrical and Electronics Engineers (IEEE)",
    "title": "Deep Self-Supervised Representation Learning for Free-Hand Sketch",
    "updated": "2025-05-22T18:42:22Z",
    "year": 2020,
    "z_authors": [
      {
        "author_position": "first",
        "is_corresponding": true,
        "raw_affiliation_strings": [
          "School of Computer Science and Engineering, Nanyang Technological University, Singapore"
        ],
        "raw_author_name": "Peng Xu"
      },
      {
        "author_position": "additional",
        "is_corresponding": false,
        "raw_affiliation_strings": [
          "School of Artificial Intelligence, Beijing University of Posts and Telecommunications, Beijing, China"
        ],
        "raw_author_name": "Zeyu Song"
      },
      {
        "author_position": "additional",
        "is_corresponding": false,
        "raw_affiliation_strings": [
          "Institute of Automation, Chinese Academy of Sciences, Beijing, China"
        ],
        "raw_author_name": "Qiyue Yin"
      },
      {
        "author_position": "additional",
        "is_corresponding": false,
        "raw_affiliation_strings": [
          "Centre for Vision, Speech and Signal Processing, University of Surrey, Guildford, U.K."
        ],
        "raw_author_name": "Yi-Zhe Song"
      },
      {
        "author_position": "last",
        "is_corresponding": false,
        "raw_affiliation_strings": [
          "Institute of Automation, Chinese Academy of Sciences, Beijing, China"
        ],
        "raw_author_name": "Liang Wang"
      }
    ]
  },
  "response_hash": "2c8692aa241216abd8a4d5670140ee5881564796e17db6bcda2c4306e3473128",
  "retrieved_at": "2026-07-14T14:15:57Z",
  "schema_version": "1.0",
  "source": "unpaywall"
}
