{
  "endpoint": "works/10.1080/00325481.1967.11693064",
  "request_key": "930c88d1568add975ac598ac4e18bf8f150069d0e718668f864890ec8aaf4a2a",
  "request_params": {},
  "response_body": {
    "message": {
      "DOI": "10.1080/00325481.1967.11693064",
      "ISSN": [
        "0032-5481",
        "1941-9260"
      ],
      "URL": "https://doi.org/10.1080/00325481.1967.11693064",
      "alternative-id": [
        "10.1080/00325481.1967.11693064"
      ],
      "author": [
        {
          "affiliation": [],
          "family": "Lamb",
          "given": "Lawrence E.",
          "role": [
            {
              "role": "author",
              "vocabulary": "crossref"
            }
          ],
          "sequence": "first"
        }
      ],
      "container-title": [
        "Postgraduate Medicine"
      ],
      "content-domain": {
        "crossmark-restriction": false,
        "domain": []
      },
      "created": {
        "date-parts": [
          [
            2016,
            4,
            18
          ]
        ],
        "date-time": "2016-04-18T20:59:43Z",
        "timestamp": 1461013183000
      },
      "deposited": {
        "date-parts": [
          [
            2019,
            9,
            6
          ]
        ],
        "date-time": "2019-09-06T16:46:54Z",
        "timestamp": 1567788414000
      },
      "indexed": {
        "date-parts": [
          [
            2022,
            4,
            1
          ]
        ],
        "date-time": "2022-04-01T10:12:40Z",
        "timestamp": 1648807960694
      },
      "is-referenced-by-count": 1,
      "issn-type": [
        {
          "type": "print",
          "value": "0032-5481"
        },
        {
          "type": "electronic",
          "value": "1941-9260"
        }
      ],
      "issue": "6",
      "issued": {
        "date-parts": [
          [
            1967,
            6
          ]
        ]
      },
      "journal-issue": {
        "issue": "6",
        "published-online": {
          "date-parts": [
            [
              2016,
              4,
              18
            ]
          ]
        },
        "published-print": {
          "date-parts": [
            [
              1967,
              6
            ]
          ]
        }
      },
      "language": "en",
      "link": [
        {
          "URL": "http://www.tandfonline.com/doi/pdf/10.1080/00325481.1967.11693064",
          "content-type": "unspecified",
          "content-version": "vor",
          "intended-application": "similarity-checking"
        }
      ],
      "member": "301",
      "original-title": [],
      "page": "569-577",
      "prefix": "10.1080",
      "published": {
        "date-parts": [
          [
            1967,
            6
          ]
        ]
      },
      "published-online": {
        "date-parts": [
          [
            2016,
            4,
            18
          ]
        ]
      },
      "published-print": {
        "date-parts": [
          [
            1967,
            6
          ]
        ]
      },
      "publisher": "Informa UK Limited",
      "reference": [
        {
          "DOI": "10.1007/BF01697566",
          "doi-asserted-by": "publisher",
          "key": "CIT0001"
        },
        {
          "DOI": "10.1152/ajplegacy.1914.35.3.292",
          "author": "Williams H. B.",
          "doi-asserted-by": "crossref",
          "first-page": "292",
          "journal-title": "Amer J Physiol",
          "key": "CIT0002",
          "volume": "35",
          "year": "1914"
        },
        {
          "DOI": "10.1098/rstb.1916.0006",
          "doi-asserted-by": "publisher",
          "key": "CIT0003"
        },
        {
          "DOI": "10.1001/archinte.1920.00090320054004",
          "doi-asserted-by": "publisher",
          "key": "CIT0004"
        },
        {
          "key": "CIT0005",
          "unstructured": "Lamb, L. E.: Electrocardiography and Vectorcardiography—Instrumentation, Fundamentals, and Clinical Applications. Philadelphia, W. B. Saunders Company, 1965."
        },
        {
          "author": "Roman J.",
          "first-page": "790",
          "journal-title": "Aerospace Med",
          "key": "CIT0006",
          "volume": "37",
          "year": "1966"
        },
        {
          "DOI": "10.1016/S0002-8703(34)90093-4",
          "doi-asserted-by": "publisher",
          "key": "CIT0007"
        },
        {
          "DOI": "10.1161/01.CIR.8.6.905",
          "doi-asserted-by": "publisher",
          "key": "CIT0008"
        }
      ],
      "reference-count": 8,
      "references-count": 8,
      "relation": {},
      "resource": {
        "primary": {
          "URL": "http://www.tandfonline.com/doi/full/10.1080/00325481.1967.11693064"
        }
      },
      "score": 1,
      "short-container-title": [
        "Postgraduate Medicine"
      ],
      "short-title": [],
      "source": "Crossref",
      "subject": [],
      "subtitle": [
        "Past, Present and Future"
      ],
      "title": [
        "Electrocardiography and Vectorcardiography"
      ],
      "type": "journal-article",
      "volume": "41"
    },
    "message-type": "work",
    "message-version": "1.0.0",
    "status": "ok"
  },
  "response_hash": "6da1fca2a3c203a2c76fd50c08353f2a8037c0baa3da44e591f2320aea4e02e4",
  "retrieved_at": "2026-07-14T13:49:28Z",
  "schema_version": "1.0",
  "source": "crossref"
}
