{
  "endpoint": "works/10.1093/s20215-2019-33108-2",
  "request_key": "4cb289ac61c1527997db3b7b9c6c97106a2c8d720c5a03cea45675f501b4ca33",
  "request_params": {},
  "response_body": null,
  "response_hash": "74234e98afe7498fb5daf1f36ac2d78acc339464f950703b8c019892f982b90b",
  "retrieved_at": "2026-07-14T14:52:02Z",
  "schema_version": "1.0",
  "source": "crossref"
}
