{
  "endpoint": "v2/10.1093/s25259-2022-88627-1",
  "request_key": "ba44030fce28eb05b6a6a96198b41b128f11b33feb9406b3974ad8567dfe4083",
  "request_params": {},
  "response_body": null,
  "response_hash": "74234e98afe7498fb5daf1f36ac2d78acc339464f950703b8c019892f982b90b",
  "retrieved_at": "2026-07-14T13:50:18Z",
  "schema_version": "1.0",
  "source": "unpaywall"
}
