{
  "endpoint": "dois/10.1152/ajpheart.00561.2010",
  "request_key": "b64dd3574aa0a4d520c4c05c5dc51a4a5de85539d146b3c94428260bcf3f2fd3",
  "request_params": {},
  "response_body": null,
  "response_hash": "74234e98afe7498fb5daf1f36ac2d78acc339464f950703b8c019892f982b90b",
  "retrieved_at": "2026-07-14T14:48:41Z",
  "schema_version": "1.0",
  "source": "datacite"
}
