{
  "endpoint": "dois/10.1109/cvpr.2019.01061",
  "request_key": "2bc54afde4f61c092262853d683e48c2294af414467759fe81da22a25d818af2",
  "request_params": {},
  "response_body": null,
  "response_hash": "74234e98afe7498fb5daf1f36ac2d78acc339464f950703b8c019892f982b90b",
  "retrieved_at": "2026-07-14T14:48:28Z",
  "schema_version": "1.0",
  "source": "datacite"
}
