{
  "endpoint": "v2/10.1109/taffc.2020.3014842",
  "request_key": "f89146899a13e9143fe7fdbac025641b2c2805c0655887425b46c2e4071e8d5b",
  "request_params": {},
  "response_body": {
    "best_oa_location": {
      "endpoint_id": "ca8f8d56758a80a4f86",
      "evidence": "deprecated",
      "host_type": "repository",
      "is_best": true,
      "license": null,
      "oa_date": "2020-08-06",
      "pmh_id": "oai:arXiv.org:2002.03898",
      "repository_institution": "Cornell University",
      "updated": "deprecated",
      "url": "https://arxiv.org/pdf/2002.03898",
      "url_for_landing_page": "http://arxiv.org/abs/2002.03898",
      "url_for_pdf": "https://arxiv.org/pdf/2002.03898",
      "version": "submittedVersion"
    },
    "data_standard": 2,
    "doi": "10.1109/taffc.2020.3014842",
    "doi_url": "https://doi.org/10.1109/taffc.2020.3014842",
    "first_oa_location": {
      "endpoint_id": "ca8f8d56758a80a4f86",
      "evidence": "deprecated",
      "host_type": "repository",
      "is_best": true,
      "license": null,
      "oa_date": "2020-08-06",
      "pmh_id": "oai:arXiv.org:2002.03898",
      "repository_institution": "Cornell University",
      "updated": "deprecated",
      "url": "https://arxiv.org/pdf/2002.03898",
      "url_for_landing_page": "http://arxiv.org/abs/2002.03898",
      "url_for_pdf": "https://arxiv.org/pdf/2002.03898",
      "version": "submittedVersion"
    },
    "genre": "journal-article",
    "has_repository_copy": true,
    "is_oa": true,
    "is_paratext": false,
    "journal_is_in_doaj": false,
    "journal_is_oa": false,
    "journal_issn_l": "1949-3045",
    "journal_issns": "1949-3045,2371-9850",
    "journal_name": "IEEE Transactions on Affective Computing",
    "oa_locations": [
      {
        "endpoint_id": "ca8f8d56758a80a4f86",
        "evidence": "deprecated",
        "host_type": "repository",
        "is_best": true,
        "license": null,
        "oa_date": "2020-08-06",
        "pmh_id": "oai:arXiv.org:2002.03898",
        "repository_institution": "Cornell University",
        "updated": "deprecated",
        "url": "https://arxiv.org/pdf/2002.03898",
        "url_for_landing_page": "http://arxiv.org/abs/2002.03898",
        "url_for_pdf": "https://arxiv.org/pdf/2002.03898",
        "version": "submittedVersion"
      }
    ],
    "oa_locations_embargoed": [],
    "oa_status": "green",
    "published_date": "2020-08-06",
    "publisher": "Institute of Electrical and Electronics Engineers (IEEE)",
    "title": "Self-Supervised ECG Representation Learning for Emotion Recognition",
    "updated": "2026-07-03T14:35:42Z",
    "year": 2020,
    "z_authors": [
      {
        "author_position": "first",
        "is_corresponding": false,
        "raw_affiliation_strings": [
          "Department of Electrical and Computer Engineering, Queen&#x0027;s University, Kingston, ON, Canada"
        ],
        "raw_author_name": "Pritam Sarkar"
      },
      {
        "author_position": "last",
        "is_corresponding": false,
        "raw_affiliation_strings": [
          "Department of Electrical and Computer Engineering, Queen&#x0027;s University, Kingston, ON, Canada"
        ],
        "raw_author_name": "Ali Etemad"
      }
    ]
  },
  "response_hash": "1268f36fbc135323814d9e9550efb15216eb4eafcedaad4678ea9405ed8c3d24",
  "retrieved_at": "2026-07-14T13:49:56Z",
  "schema_version": "1.0",
  "source": "unpaywall"
}
