{
  "endpoint": "v2/10.1038/s42256-023-00640-6",
  "request_key": "8a091c450dbb10956e3e21a7772d3b44b8afaf90d38b3cd61da4b51e3b3481c5",
  "request_params": {},
  "response_body": {
    "best_oa_location": {
      "endpoint_id": null,
      "evidence": "deprecated",
      "host_type": "publisher",
      "is_best": true,
      "license": "cc-by",
      "oa_date": "2023-04-24",
      "pmh_id": null,
      "repository_institution": null,
      "updated": "deprecated",
      "url": "https://www.nature.com/articles/s42256-023-00640-6.pdf",
      "url_for_landing_page": "https://doi.org/10.1038/s42256-023-00640-6",
      "url_for_pdf": "https://www.nature.com/articles/s42256-023-00640-6.pdf",
      "version": "publishedVersion"
    },
    "data_standard": 2,
    "doi": "10.1038/s42256-023-00640-6",
    "doi_url": "https://doi.org/10.1038/s42256-023-00640-6",
    "first_oa_location": {
      "endpoint_id": null,
      "evidence": "deprecated",
      "host_type": "publisher",
      "is_best": true,
      "license": "cc-by",
      "oa_date": "2023-04-24",
      "pmh_id": null,
      "repository_institution": null,
      "updated": "deprecated",
      "url": "https://www.nature.com/articles/s42256-023-00640-6.pdf",
      "url_for_landing_page": "https://doi.org/10.1038/s42256-023-00640-6",
      "url_for_pdf": "https://www.nature.com/articles/s42256-023-00640-6.pdf",
      "version": "publishedVersion"
    },
    "genre": "journal-article",
    "has_repository_copy": false,
    "is_oa": true,
    "is_paratext": false,
    "journal_is_in_doaj": false,
    "journal_is_oa": false,
    "journal_issn_l": "2522-5839",
    "journal_issns": "2522-5839",
    "journal_name": "Nature Machine Intelligence",
    "oa_locations": [
      {
        "endpoint_id": null,
        "evidence": "deprecated",
        "host_type": "publisher",
        "is_best": true,
        "license": "cc-by",
        "oa_date": "2023-04-24",
        "pmh_id": null,
        "repository_institution": null,
        "updated": "deprecated",
        "url": "https://www.nature.com/articles/s42256-023-00640-6.pdf",
        "url_for_landing_page": "https://doi.org/10.1038/s42256-023-00640-6",
        "url_for_pdf": "https://www.nature.com/articles/s42256-023-00640-6.pdf",
        "version": "publishedVersion"
      }
    ],
    "oa_locations_embargoed": [],
    "oa_status": "hybrid",
    "published_date": "2023-04-24",
    "publisher": "Springer Science and Business Media LLC",
    "title": "Multitask joint strategies of self-supervised representation learning on biomedical networks for drug discovery",
    "updated": "2025-09-30T02:39:23Z",
    "year": 2023,
    "z_authors": [
      {
        "author_position": "first",
        "is_corresponding": false,
        "raw_affiliation_strings": [
          "College of Computer Science and Electronic Engineering, Hunan University, Changsha, China"
        ],
        "raw_author_name": "Xiaoqi Wang"
      },
      {
        "author_position": "middle",
        "is_corresponding": false,
        "raw_affiliation_strings": [
          "College of Computer Science and Electronic Engineering, Hunan University, Changsha, China"
        ],
        "raw_author_name": "Yingjie Cheng"
      },
      {
        "author_position": "middle",
        "is_corresponding": false,
        "raw_affiliation_strings": [
          "College of Computer Science and Electronic Engineering, Hunan University, Changsha, China"
        ],
        "raw_author_name": "Yaning Yang"
      },
      {
        "author_position": "middle",
        "is_corresponding": false,
        "raw_affiliation_strings": [
          "Peng Cheng Laboratory, Shenzhen, China"
        ],
        "raw_author_name": "Yue Yu"
      },
      {
        "author_position": "middle",
        "is_corresponding": true,
        "raw_affiliation_strings": [
          "Computer Network Information Center, Chinese Academy of Sciences, Beijing, China",
          "Computer Network Information Center, Chinese Academy of Sciences, Beijing, China"
        ],
        "raw_author_name": "Fei Li"
      },
      {
        "author_position": "last",
        "is_corresponding": false,
        "raw_affiliation_strings": [
          "Peng Cheng Laboratory, Shenzhen, China"
        ],
        "raw_author_name": "Shaoliang Peng"
      }
    ]
  },
  "response_hash": "fe81e0f9dd7daaef6933ad591d8a11c6086835195abfa969e13a0685215a01ac",
  "retrieved_at": "2026-07-14T13:49:56Z",
  "schema_version": "1.0",
  "source": "unpaywall"
}
