{
  "endpoint": "dois/10.1371/s11891-2021-55623-3",
  "request_key": "94d01131eaf19df6c0ab8c7d5e7c394c8fba0ca3e3fd170a72cb005f5980e171",
  "request_params": {},
  "response_body": null,
  "response_hash": "74234e98afe7498fb5daf1f36ac2d78acc339464f950703b8c019892f982b90b",
  "retrieved_at": "2026-07-14T14:34:36Z",
  "schema_version": "1.0",
  "source": "datacite"
}
