{
  "endpoint": "query",
  "request_key": "3d5ebad9b19e7d4a3279da8ec8c069755b59bbe943128ee9b8fb171420158e4e",
  "request_params": {
    "max_results": 10,
    "search_query": "all:\"Automated Atrial Fibrillation Detection using a Hybrid CNN-LSTM Network on Imbalanced ECG\"",
    "sortBy": "relevance",
    "sortOrder": "descending",
    "start": 0
  },
  "response_body": {
    "entries": [],
    "items_per_page": 10,
    "start_index": 0,
    "total_results": 0
  },
  "response_hash": "6bc11ffbdab5cacc12211af0262d7e363dc4b9fd66a0bebb785c8a2fbe5994a4",
  "retrieved_at": "2026-07-14T14:10:20Z",
  "schema_version": "1.0",
  "source": "arxiv"
}
