{
  "endpoint": "dois",
  "request_key": "bf7516f37485bc6d7595ef74464425b7f86cbba73e3151e5f87d046a600acbd2",
  "request_params": {
    "page[size]": 5,
    "query": "Passive Detection of Atrial Fibrillation Using a Commercially Available Smartwatch"
  },
  "response_body": {
    "data": [],
    "links": {
      "self": "https://api.datacite.org/dois?query=Passive+Detection+of+Atrial+Fibrillation+Using+a+Commercially+Available+Smartwatch&page%5Bsize%5D=5"
    },
    "meta": {
      "page": 1,
      "total": 0,
      "totalPages": 0
    }
  },
  "response_hash": "c59abed78aef23410d7f2fa730c0bac5c6ec9358d1e12b4d903fc7ff8fc4b8af",
  "retrieved_at": "2026-07-14T14:48:45Z",
  "schema_version": "1.0",
  "source": "datacite"
}
