{
  "endpoint": "works/10.7283/2ykk-3g92",
  "request_key": "db24bc9cd095182d2a25c25fa2efca5d8847557a040ed9832d53747798e79840",
  "request_params": {},
  "response_body": null,
  "response_hash": "74234e98afe7498fb5daf1f36ac2d78acc339464f950703b8c019892f982b90b",
  "retrieved_at": "2026-07-14T13:48:28Z",
  "schema_version": "1.0",
  "source": "crossref"
}
