{
  "endpoint": "works/10.1037/emo0001463",
  "request_key": "518c4244695a34106aca14576df561487a2a8e4097bc33c9896d66ee7ae645b1",
  "request_params": {},
  "response_body": {
    "message": {
      "DOI": "10.1037/emo0001463",
      "ISSN": [
        "1931-1516",
        "1528-3542"
      ],
      "URL": "https://doi.org/10.1037/emo0001463",
      "alternative-id": [
        "2025-58948-001",
        "39699601"
      ],
      "author": [
        {
          "ORCID": "https://orcid.org/0000-0002-6767-8604",
          "affiliation": [],
          "authenticated-orcid": false,
          "family": "Walker",
          "given": "Sarah A.",
          "role": [
            {
              "role": "author",
              "vocabulary": "crossref"
            }
          ],
          "sequence": "first"
        },
        {
          "ORCID": "https://orcid.org/0000-0002-8517-2236",
          "affiliation": [],
          "authenticated-orcid": false,
          "family": "López-Pérez",
          "given": "Belén",
          "role": [
            {
              "role": "author",
              "vocabulary": "crossref"
            }
          ],
          "sequence": "additional"
        },
        {
          "ORCID": "https://orcid.org/0000-0002-4006-9999",
          "affiliation": [],
          "authenticated-orcid": false,
          "family": "Beckmann",
          "given": "Jens F.",
          "role": [
            {
              "role": "author",
              "vocabulary": "crossref"
            }
          ],
          "sequence": "additional"
        },
        {
          "ORCID": "https://orcid.org/0000-0002-7382-0881",
          "affiliation": [],
          "authenticated-orcid": false,
          "family": "Kunst",
          "given": "Hannah",
          "role": [
            {
              "role": "author",
              "vocabulary": "crossref"
            }
          ],
          "sequence": "additional"
        },
        {
          "ORCID": "https://orcid.org/0000-0002-1122-569X",
          "affiliation": [],
          "authenticated-orcid": false,
          "family": "Polias",
          "given": "Shayne",
          "role": [
            {
              "role": "author",
              "vocabulary": "crossref"
            }
          ],
          "sequence": "additional"
        }
      ],
      "container-title": [
        "Emotion"
      ],
      "content-domain": {
        "crossmark-restriction": false,
        "domain": []
      },
      "created": {
        "date-parts": [
          [
            2024,
            12,
            31
          ]
        ],
        "date-time": "2024-12-31T10:13:49Z",
        "timestamp": 1735640029000
      },
      "deposited": {
        "date-parts": [
          [
            2025,
            10,
            2
          ]
        ],
        "date-time": "2025-10-02T13:21:51Z",
        "timestamp": 1759411311000
      },
      "indexed": {
        "date-parts": [
          [
            2026,
            1,
            23
          ]
        ],
        "date-time": "2026-01-23T19:00:34Z",
        "timestamp": 1769194834629,
        "version": "3.49.0"
      },
      "is-referenced-by-count": 1,
      "issn-type": [
        {
          "type": "electronic",
          "value": "1931-1516"
        },
        {
          "type": "print",
          "value": "1528-3542"
        }
      ],
      "issue": "4",
      "issued": {
        "date-parts": [
          [
            2025,
            6
          ]
        ]
      },
      "journal-issue": {
        "issue": "4",
        "published-online": {
          "date-parts": [
            [
              2025,
              6
            ]
          ]
        }
      },
      "language": "en",
      "license": [
        {
          "URL": "https://creativecommons.org/licenses/by/4.0",
          "content-version": "vor",
          "delay-in-days": 0,
          "start": {
            "date-parts": [
              [
                2024,
                12,
                19
              ]
            ],
            "date-time": "2024-12-19T00:00:00Z",
            "timestamp": 1734566400000
          }
        }
      ],
      "link": [
        {
          "URL": "https://psycnet.apa.org/journals/emo/25/4/922.pdf",
          "content-type": "unspecified",
          "content-version": "vor",
          "intended-application": "similarity-checking"
        }
      ],
      "member": "15",
      "original-title": [],
      "page": "922-928",
      "prefix": "10.1037",
      "published": {
        "date-parts": [
          [
            2025,
            6
          ]
        ]
      },
      "published-online": {
        "date-parts": [
          [
            2025,
            6
          ]
        ]
      },
      "publisher": "American Psychological Association (APA)",
      "reference-count": 0,
      "references-count": 0,
      "relation": {
        "correction": [
          {
            "asserted-by": "object",
            "id": "10.1037/emo0001597",
            "id-type": "doi"
          }
        ]
      },
      "resource": {
        "primary": {
          "URL": "https://doi.apa.org/doi/10.1037/emo0001463"
        }
      },
      "score": 1,
      "short-container-title": [
        "Emotion"
      ],
      "short-title": [],
      "source": "Crossref",
      "subject": [],
      "subtitle": [],
      "title": [
        "The need for a unified language framework in extrinsic interpersonal emotion regulation research."
      ],
      "type": "journal-article",
      "update-policy": "https://doi.org/10.1037/emo0001463",
      "updated-by": [
        {
          "DOI": "10.1037/emo0001597",
          "label": "Correction",
          "source": "publisher",
          "type": "correction",
          "updated": {
            "date-parts": [
              [
                2025,
                10,
                2
              ]
            ],
            "date-time": "2025-10-02T00:00:00Z",
            "timestamp": 1759363200000
          }
        }
      ],
      "volume": "25"
    },
    "message-type": "work",
    "message-version": "1.0.0",
    "status": "ok"
  },
  "response_hash": "d068f2c6bd873ad533cd522771cee560070ca8ecf5f30aa1f851d04015ca7b16",
  "retrieved_at": "2026-07-14T13:49:07Z",
  "schema_version": "1.0",
  "source": "crossref"
}
