{
  "endpoint": "query",
  "request_key": "15065b3d9b30bfca6b3329e0f0de72076cd1e1ae28b808d8284afd473119be57",
  "request_params": {
    "max_results": 10,
    "search_query": "all:\"Automatic multilabel electrocardiogram diagnosis of heart rhythm or conduction abnormaliti\"",
    "sortBy": "relevance",
    "sortOrder": "descending",
    "start": 0
  },
  "response_body": {
    "entries": [],
    "items_per_page": 10,
    "start_index": 0,
    "total_results": 0
  },
  "response_hash": "6bc11ffbdab5cacc12211af0262d7e363dc4b9fd66a0bebb785c8a2fbe5994a4",
  "retrieved_at": "2026-07-14T13:50:51Z",
  "schema_version": "1.0",
  "source": "arxiv"
}
