{
  "endpoint": "works/10.1001/jama.288.3.321",
  "request_key": "cddea788e42b0cf6e3477f157b901c660decd7626711232a8c1806da22228f98",
  "request_params": {},
  "response_body": {
    "message": {
      "DOI": "10.1001/jama.288.3.321",
      "ISSN": [
        "0098-7484",
        "1538-3598"
      ],
      "URL": "https://doi.org/10.1001/jama.288.3.321",
      "author": [
        {
          "affiliation": [],
          "family": "Writing Group for the Women's Health Initiative Investigators",
          "role": [
            {
              "role": "author",
              "vocabulary": "crossref"
            }
          ],
          "sequence": "first"
        }
      ],
      "container-title": [
        "JAMA: The Journal of the American Medical Association"
      ],
      "content-domain": {
        "crossmark-restriction": false,
        "domain": []
      },
      "created": {
        "date-parts": [
          [
            2003,
            3,
            18
          ]
        ],
        "date-time": "2003-03-18T15:05:58Z",
        "timestamp": 1047999958000
      },
      "deposited": {
        "date-parts": [
          [
            2016,
            12,
            15
          ]
        ],
        "date-time": "2016-12-15T17:53:19Z",
        "timestamp": 1481824399000
      },
      "indexed": {
        "date-parts": [
          [
            2026,
            7,
            14
          ]
        ],
        "date-time": "2026-07-14T00:21:14Z",
        "timestamp": 1783988474449,
        "version": "3.55.0"
      },
      "is-referenced-by-count": 12664,
      "issn-type": [
        {
          "type": "print",
          "value": "0098-7484"
        },
        {
          "type": "electronic",
          "value": "1538-3598"
        }
      ],
      "issue": "3",
      "issued": {
        "date-parts": [
          [
            2002,
            7,
            17
          ]
        ]
      },
      "journal-issue": {
        "issue": "3"
      },
      "link": [
        {
          "URL": "http://jamanetwork.com/journals/jama/fullarticle/195120",
          "content-type": "unspecified",
          "content-version": "vor",
          "intended-application": "similarity-checking"
        }
      ],
      "member": "10",
      "original-title": [],
      "page": "321-333",
      "prefix": "10.1001",
      "published": {
        "date-parts": [
          [
            2002,
            7,
            17
          ]
        ]
      },
      "published-print": {
        "date-parts": [
          [
            2002,
            7,
            17
          ]
        ]
      },
      "publisher": "American Medical Association (AMA)",
      "reference-count": 0,
      "references-count": 0,
      "relation": {},
      "resource": {
        "primary": {
          "URL": "http://jama.ama-assn.org/cgi/doi/10.1001/jama.288.3.321"
        }
      },
      "score": 1,
      "short-container-title": [],
      "short-title": [],
      "source": "Crossref",
      "subject": [],
      "subtitle": [],
      "title": [
        "Risks and Benefits of Estrogen Plus Progestin in Healthy Postmenopausal Women: Principal Results From the Women's Health Initiative Randomized Controlled Trial"
      ],
      "type": "journal-article",
      "volume": "288"
    },
    "message-type": "work",
    "message-version": "1.0.0",
    "status": "ok"
  },
  "response_hash": "c27904d5c263d8cbc590e2e411b9e4f5327d6d1abc7409c7c3f7dc75b3539bc9",
  "retrieved_at": "2026-07-14T14:48:50Z",
  "schema_version": "1.0",
  "source": "crossref"
}
